[
  {
    "directive": "html-if",
    "category": "conditional-rendering",
    "description": "Conditionally includes the host element in rendered output.",
    "syntax": "<div html-if=\"expression\"></div>",
    "valueType": "JavaScript expression evaluated against render state",
    "behavior": [
      "The directive attribute is removed during template transformation.",
      "The element is wrapped in an if block.",
      "Falsy values omit the element from the rendered HTML.",
      "Throwing expressions are caught by safe() and behave as falsy."
    ],
    "examples": ["<p html-if=\"isOpen\">Open</p>", "<p html-if=\"items.length === 0\">Empty</p>"],
    "antiPatterns": ["Performing side effects in the expression.", "Using it to hide large static sections that never change."],
    "relatedDirectives": ["html-for", "html-inner"],
    "runtimeNotes": ["Runs during render, not as an isolated observer."],
    "performanceNotes": ["Cheap for small sections; split large dynamic areas into child components."]
  },
  {
    "directive": "html-for",
    "category": "list-rendering",
    "description": "Repeats the host element for each key in an object or array-like state value.",
    "syntax": "<li html-for=\"item in items\">{{ item.name }}</li>",
    "valueType": "Pattern: localName in expression",
    "behavior": [
      "The directive attribute is removed during template transformation.",
      "Each iteration exposes the item variable, $index, and $key.",
      "Loop scope is stored internally and can flow to child components.",
      "Iteration uses for...in over the evaluated object."
    ],
    "examples": ["<li html-for=\"todo in todos\">{{ todo.title }}</li>"],
    "antiPatterns": ["Depending on iteration order for non-array objects.", "Using generated scope ids as stable keys."],
    "relatedDirectives": ["html-if", "html-scopeid"],
    "runtimeNotes": ["The runtime creates a transient scope object per iteration."],
    "performanceNotes": ["Prefer smaller child components for expensive list rows."]
  },
  {
    "directive": "html-inner",
    "category": "content-binding",
    "description": "Replaces the host element inner HTML with an evaluated expression.",
    "syntax": "<span html-inner=\"name\">Fallback</span>",
    "valueType": "JavaScript expression evaluated against render state",
    "behavior": [
      "The directive attribute is removed during template transformation.",
      "The original inner HTML becomes a progressive fallback.",
      "Rendered value is inserted into element content."
    ],
    "examples": ["<strong html-inner=\"totalLabel\">$0.00</strong>"],
    "antiPatterns": ["Rendering untrusted HTML strings.", "Using it when plain mustache text is enough and no fallback is needed."],
    "relatedDirectives": ["html-if", "template"],
    "runtimeNotes": ["Equivalent to putting an expression inside the element body after compilation."],
    "performanceNotes": ["Prefer scalar strings or trusted markup."]
  },
  {
    "directive": "html-class",
    "category": "attribute-binding",
    "description": "Appends a computed class string to the existing class attribute.",
    "syntax": "<div class=\"panel\" html-class=\"isOpen ? 'is-open' : ''\"></div>",
    "valueType": "JavaScript expression returning a string",
    "behavior": [
      "Existing class text is preserved.",
      "The expression output is appended to the class attribute.",
      "Falsy or failing expressions produce an empty string."
    ],
    "examples": ["<button html-class=\"isSaving ? 'is-busy' : ''\">Save</button>"],
    "antiPatterns": ["Returning arrays or objects without converting to a string.", "Duplicating base classes in the expression."],
    "relatedDirectives": ["html-*"],
    "runtimeNotes": ["Special-cased before generic html-* attribute transformation."],
    "performanceNotes": ["Keep class expressions simple."]
  },
  {
    "directive": "html-model",
    "category": "state-initialization",
    "description": "Defines instance initial state on a component element.",
    "syntax": "<app-counter html-model=\"{ count: 5 }\"></app-counter>",
    "valueType": "JavaScript object literal expression",
    "behavior": [
      "Parsed with new Function during component construction.",
      "Overrides exported model keys.",
      "Available to functional model as initialState."
    ],
    "examples": ["<user-card html-model=\"{ userId: 10 }\"></user-card>"],
    "antiPatterns": ["Passing untrusted user input.", "Putting large datasets in attributes."],
    "relatedDirectives": ["data-*", "model"],
    "runtimeNotes": ["Only valid on component roots."],
    "performanceNotes": ["Prefer small serializable values."]
  },
  {
    "directive": "html-static",
    "category": "dom-ownership",
    "description": "Prevents Jails morphing from changing a node and its descendants.",
    "syntax": "<div html-static></div>",
    "valueType": "boolean attribute",
    "behavior": [
      "When morphing reaches the node, Jails returns false from beforeNodeMorphed.",
      "The existing DOM subtree remains intact.",
      "State changes do not update content below this node."
    ],
    "examples": ["<div class=\"swiper\" html-static></div>", "<input name=\"q\" html-static>"],
    "antiPatterns": ["Marking state-driven content static.", "Using it to hide rendering bugs."],
    "relatedDirectives": ["innerHTML"],
    "runtimeNotes": ["Detected by attribute presence."],
    "performanceNotes": ["Useful for reducing morph cost around third-party DOM."]
  },
  {
    "directive": "html-*",
    "category": "attribute-binding",
    "description": "Binds any normal HTML attribute from a JavaScript expression and strips the html- prefix.",
    "syntax": "<img html-src=\"imageUrl\" html-alt=\"label\">",
    "valueType": "JavaScript expression",
    "behavior": [
      "The rendered attribute name is the text after html-.",
      "Values are evaluated against render state.",
      "Boolean attributes have special handling for native boolean names.",
      "html-model and html-scopeid are reserved and not transformed as generic attributes."
    ],
    "examples": ["<a html-href=\"url\">Open</a>", "<button html-disabled=\"isSaving\">Save</button>"],
    "antiPatterns": ["Using html-onclick instead of delegated events.", "Binding unsafe URLs without validation."],
    "relatedDirectives": ["html-class"],
    "runtimeNotes": ["Expressions may omit outer braces: html-src=\"imageUrl\"."],
    "performanceNotes": ["Avoid expensive computations in attribute expressions."]
  },
  {
    "directive": "template",
    "category": "native-template",
    "description": "Uses the native template element to hide dynamic markup before Jails compiles it.",
    "syntax": "<template><p>{{ value }}</p></template>",
    "valueType": "HTML content",
    "behavior": [
      "Template content is transformed recursively.",
      "Plain templates are unwrapped during compilation.",
      "Templates that carry html-if or html-inner are preserved for directive behavior."
    ],
    "examples": ["<template><li html-for=\"item in items\">{{ item.name }}</li></template>"],
    "antiPatterns": ["Wrapping all markup in template when SSR fallback is desired."],
    "relatedDirectives": ["html-if", "html-inner", "html-for"],
    "runtimeNotes": ["The browser does not render template contents before JavaScript."],
    "performanceNotes": ["Useful to prevent placeholder flicker."]
  }
]

